{"limit_policy_version":"1.0","minimum_reader_version":"0.2.0","record_digest":"f12f5cdc9fcb95b9f8d449ab1253023e9580a3997aaa93116c145ec538eaeaf6","schema_digest":"606ca57ef9cd17dd6227fe9100dc6ed666a45138c1d3f1bd326ed11342bf463f","schema_version":"1.0","tools":[{"artifacts":[{"archive_type":"tar.gz","executable":"codex-x86_64-unknown-linux-musl","platform":"linux-x86_64","sha256":"37c985be9d89e8c4f43b3aa0594c1213eac212d30ae2b95221f08fec807515d1","url":"https://github.com/openai/codex/releases/download/rust-v0.144.4/codex-x86_64-unknown-linux-musl.tar.gz"},{"archive_type":"tar.gz","executable":"codex-aarch64-apple-darwin","platform":"macos-arm64","sha256":"77c8969a481302f9db1d9ea2a6c21c083abae3f1a8fc8a7275dc38323699391e","url":"https://github.com/openai/codex/releases/download/rust-v0.144.4/codex-aarch64-apple-darwin.tar.gz"},{"archive_type":"tar.gz","executable":"codex-x86_64-apple-darwin","platform":"macos-x86_64","sha256":"274ea4931246621d477ad61d61ea3303527878e77fa910087df52153f5e6188e","url":"https://github.com/openai/codex/releases/download/rust-v0.144.4/codex-x86_64-apple-darwin.tar.gz"},{"archive_type":"zip","executable":"codex-x86_64-pc-windows-msvc.exe","platform":"windows-x86_64","sha256":"d731eee110fe287fcb8e201e9bdf39920e863bfc3c97f21e2d697a35d38c63c5","url":"https://github.com/openai/codex/releases/download/rust-v0.144.4/codex-x86_64-pc-windows-msvc.exe.zip"}],"authority":"OpenAI GitHub release rust-v0.144.4","license":"Apache-2.0","name":"codex","source_commit":"8c68d4c87dc54d38861f5114e920c3de2efa5876","version":"0.144.4"},{"artifacts":[{"archive_type":"wheel","executable":"plugin-scanner","platform":"any","sha256":"0f400a23a3764cdefd741e2fc7a30300a88d0a8d5cb8e52b3e1c94066df80d58","url":"https://files.pythonhosted.org/packages/4d/44/592da0d13c5fb45e12c9581f92571f108158dd8d33fdb05f15b2411f49eb/plugin_scanner-2.0.274-py3-none-any.whl"}],"authority":"PyPI PEP 740 workflow provenance","license":"Apache-2.0","name":"plugin-scanner","source_commit":"4bef9dd3025b03b16e1f121959e5437b39cf05ef","version":"2.0.274"},{"artifacts":[{"archive_type":"tar.gz","executable":"uv-x86_64-unknown-linux-gnu/uv","platform":"linux-x86_64","sha256":"e12c4cda2fe8c305510a78380a88f2c32a27e90cdcd123cefd2873388f0ebb5f","url":"https://github.com/astral-sh/uv/releases/download/0.11.23/uv-x86_64-unknown-linux-gnu.tar.gz"},{"archive_type":"tar.gz","executable":"uv-aarch64-apple-darwin/uv","platform":"macos-arm64","sha256":"71ef9de85db820749b3b12b7585624ee279e9c5afcbc6f8236bc3d628c4305b0","url":"https://github.com/astral-sh/uv/releases/download/0.11.23/uv-aarch64-apple-darwin.tar.gz"},{"archive_type":"tar.gz","executable":"uv-x86_64-apple-darwin/uv","platform":"macos-x86_64","sha256":"7a88155033cc469bba5bd5a24212e355eb92e3e2a276320b669ec576296c1e25","url":"https://github.com/astral-sh/uv/releases/download/0.11.23/uv-x86_64-apple-darwin.tar.gz"},{"archive_type":"zip","executable":"uv.exe","platform":"windows-x86_64","sha256":"02ad29f07e674d68726ba3bb1ff25b335d83515756e2b1a194bb56c3cc30e07c","url":"https://github.com/astral-sh/uv/releases/download/0.11.23/uv-x86_64-pc-windows-msvc.zip"}],"authority":"Astral GitHub immutable release 0.11.23","license":"Apache-2.0 OR MIT","name":"uv","source_commit":"3cdf50e0924f1ace7a92ddbac98b12a958b87688","version":"0.11.23"},{"artifacts":[{"archive_type":"wheel","executable":"uv_build","platform":"linux-x86_64","sha256":"cb5265d4f692e30889d6ef81608041e970763c684919acdb41ed6af5c345296b","url":"https://files.pythonhosted.org/packages/60/18/ecaa17214c0294c19131f0fc72dfd1b060fb6bac1731c2675749dc46f4a6/uv_build-0.11.28-py3-none-manylinux_2_17_x86_64.manylinux2014_x86_64.whl"},{"archive_type":"wheel","executable":"uv_build","platform":"macos-arm64","sha256":"3ec5e107bb7128cd15c274f9562b966b038f6342cb7c94239c02e4f1809e7690","url":"https://files.pythonhosted.org/packages/bf/8b/e832ffc1c4efa9bb4f3897e9b05edd844ef21f5d5987e9a0ea5a1e95ac91/uv_build-0.11.28-py3-none-macosx_11_0_arm64.whl"},{"archive_type":"wheel","executable":"uv_build","platform":"macos-x86_64","sha256":"384a352d6b00df4824dcb56baa070498666795c3fd1b6d7377368649b695f864","url":"https://files.pythonhosted.org/packages/47/a2/3859648b141b4ce7adccf6f8e905afdaf002af306243e4905dd898cfdaef/uv_build-0.11.28-py3-none-macosx_10_12_x86_64.whl"},{"archive_type":"wheel","executable":"uv_build","platform":"windows-x86_64","sha256":"52ad1a230e2a0e7dfdf1fa6a93e40a94fcf3c390ab2aa44a7bd0d31b780d02ed","url":"https://files.pythonhosted.org/packages/9e/90/81336f067349baa0aedb5cd4be9c3cb778b6bcba081a9f9c31ec07933b38/uv_build-0.11.28-py3-none-win_amd64.whl"}],"authority":"PyPI registry and verified Astral tag","license":"Apache-2.0 OR MIT","name":"uv-build","source_commit":"ebf0f43d7c4267876fc256f5fce75982c33f4399","version":"0.11.28"}],"writer_version":"0.2.0"}
